0.000000 0.000000 IP 192.168.10.201.59864 > 192.168.10.16.24: Flags [S], seq 603873266, win 29200, options [mss 1460,sackOK,TS val 3147423903 ecr 0,nop,wscale 7], length 0
0.000082 0.000082 IP 192.168.10.16.24 > 192.168.10.201.59864: Flags [S.], seq 55188, ack 603873267, win 1024, options [mss 1460], length 0
0.000127 0.000045 IP 192.168.10.201.59864 > 192.168.10.16.24: Flags [.], ack 1, win 29200, length 0
2.017748 2.017621 IP 192.168.10.201.34055 > 192.168.10.16.4660: UDP, length 9
2.017839 0.000091 IP 192.168.10.16.4660 > 192.168.10.201.34055: UDP, length 9
2.021183 0.003344 IP 192.168.10.16.24 > 192.168.10.201.59864: Flags [.], seq 1:621, ack 1, win 65519, length 620
2.021209 0.000026 IP 192.168.10.201.59864 > 192.168.10.16.24: Flags [.], ack 621, win 30380, length 0
3.019028 0.997819 IP 192.168.10.201.36440 > 192.168.10.16.4660: UDP, length 9
3.019083 0.000055 IP 192.168.10.16.4660 > 192.168.10.201.36440: UDP, length 9
3.023174 0.004091 IP 192.168.10.16.24 > 192.168.10.201.59864: Flags [.], seq 621:1241, ack 1, win 65519, length 620
3.023185 0.000011 IP 192.168.10.201.59864 > 192.168.10.16.24: Flags [.], ack 1241, win 31620, length 0
4.020272 0.997087 IP 192.168.10.201.33668 > 192.168.10.16.4660: UDP, length 9
4.020323 0.000051 IP 192.168.10.16.4660 > 192.168.10.201.33668: UDP, length 9
4.024166 0.003843 IP 192.168.10.16.24 > 192.168.10.201.59864: Flags [.], seq 1241:1861, ack 1, win 65519, length 620
4.024175 0.000009 IP 192.168.10.201.59864 > 192.168.10.16.24: Flags [.], ack 1861, win 32860, length 0
5.021553 0.997378 IP 192.168.10.201.49870 > 192.168.10.16.4660: UDP, length 9
5.021621 0.000068 IP 192.168.10.16.4660 > 192.168.10.201.49870: UDP, length 9
5.025157 0.003536 IP 192.168.10.16.24 > 192.168.10.201.59864: Flags [.], seq 1861:2481, ack 1, win 65519, length 620
5.025166 0.000009 IP 192.168.10.201.59864 > 192.168.10.16.24: Flags [.], ack 2481, win 34100, length 0
5.398307 0.373141 ARP, Request who-has 192.168.10.16 tell 192.168.10.201, length 28
5.398358 0.000051 ARP, Reply 192.168.10.16 is-at 02:00:c0:a8:00:10, length 46
6.022833 0.624475 IP 192.168.10.201.60776 > 192.168.10.16.4660: UDP, length 9
6.022911 0.000078 IP 192.168.10.16.4660 > 192.168.10.201.60776: UDP, length 9
6.026202 0.003291 IP 192.168.10.16.24 > 192.168.10.201.59864: Flags [.], seq 2481:3101, ack 1, win 65519, length 620
6.026212 0.000010 IP 192.168.10.201.59864 > 192.168.10.16.24: Flags [.], ack 3101, win 35340, length 0
7.024128 0.997916 IP 192.168.10.201.37703 > 192.168.10.16.4660: UDP, length 9
7.024203 0.000075 IP 192.168.10.16.4660 > 192.168.10.201.37703: UDP, length 9
7.028189 0.003986 IP 192.168.10.16.24 > 192.168.10.201.59864: Flags [.], seq 3101:3721, ack 1, win 65519, length 620
7.028199 0.000010 IP 192.168.10.201.59864 > 192.168.10.16.24: Flags [.], ack 3721, win 36580, length 0
8.024427 0.996228 IP 192.168.10.201.35908 > 192.168.10.16.4660: UDP, length 9
8.024495 0.000068 IP 192.168.10.16.4660 > 192.168.10.201.35908: UDP, length 9
8.028183 0.003688 IP 192.168.10.16.24 > 192.168.10.201.59864: Flags [.], seq 3721:4341, ack 1, win 65519, length 620
8.028198 0.000015 IP 192.168.10.201.59864 > 192.168.10.16.24: Flags [.], ack 4341, win 37820, length 0
9.025717 0.997519 IP 192.168.10.201.57065 > 192.168.10.16.4660: UDP, length 9
9.025786 0.000069 IP 192.168.10.16.4660 > 192.168.10.201.57065: UDP, length 9
9.029175 0.003389 IP 192.168.10.16.24 > 192.168.10.201.59864: Flags [.], seq 4341:4961, ack 1, win 65519, length 620
9.029184 0.000009 IP 192.168.10.201.59864 > 192.168.10.16.24: Flags [.], ack 4961, win 39060, length 0
10.000008 0.970824 going send stop request. going shutdown(,SHUT_WR)
10.000126 0.000118 IP 192.168.10.201.59864 > 192.168.10.16.24: Flags [F.], seq 1, ack 4961, win 39060, length 0
10.000135 0.000009 shutdown(,SHUT_WR) done
10.000170 0.000035 IP 192.168.10.16.24 > 192.168.10.201.59864: Flags [F.], seq 4961, ack 2, win 1024, length 0
10.000187 0.000017 IP 192.168.10.201.59864 > 192.168.10.16.24: Flags [.], ack 4962, win 39060, length 0
10.000204 0.000017 receive EOF
10.000224 0.000020 going close()
10.000255 0.000031 close() done
10.027010 0.026755 IP 192.168.10.201.46590 > 192.168.10.16.4660: UDP, length 9
10.027077 0.000067 IP 192.168.10.16.4660 > 192.168.10.201.46590: UDP, length 9
11.028334 1.001257 IP 192.168.10.201.41002 > 192.168.10.16.4660: UDP, length 9
11.028393 0.000059 IP 192.168.10.16.4660 > 192.168.10.201.41002: UDP, length 9
12.029614 1.001221 IP 192.168.10.201.53394 > 192.168.10.16.4660: UDP, length 9
12.029708 0.000094 IP 192.168.10.16.4660 > 192.168.10.201.53394: UDP, length 9
13.030922 1.001214 IP 192.168.10.201.54936 > 192.168.10.16.4660: UDP, length 9
13.031005 0.000083 IP 192.168.10.16.4660 > 192.168.10.201.54936: UDP, length 9
