16:30:09.036583 IP 192.168.10.201.33600 > 192.168.10.16.24: Flags [.], ack 223863261, win 64240, length 0
16:30:09.036829 IP 192.168.10.16.24 > 192.168.10.201.33600: Flags [.], seq 223863261:223893921, ack 1, win 5271, length 30660
16:30:09.036834 IP 192.168.10.201.33600 > 192.168.10.16.24: Flags [.], ack 223893921, win 64240, length 0
16:30:09.037077 IP 192.168.10.16.24 > 192.168.10.201.33600: Flags [.], seq 223893921:223917281, ack 1, win 5271, length 23360
16:30:09.037088 IP 192.168.10.201.33600 > 192.168.10.16.24: Flags [.], ack 223917281, win 64240, length 0
16:30:09.037264 IP 192.168.10.201.33600 > 192.168.10.16.24: Flags [F.], seq 1, ack 223917281, win 64240, length 0
16:30:09.037332 IP 192.168.10.16.24 > 192.168.10.201.33600: Flags [.], seq 223917281:223947941, ack 1, win 5271, length 30660
16:30:09.037344 IP 192.168.10.201.33600 > 192.168.10.16.24: Flags [.], ack 223947941, win 64240, length 0
16:30:09.037565 IP 192.168.10.16.24 > 192.168.10.201.33600: Flags [.], seq 223947941:223949401, ack 2, win 1024, length 1460
16:30:09.040481 IP 192.168.10.16.24 > 192.168.10.201.33600: Flags [.], seq 223949401:223950022, ack 2, win 1024, length 621
16:30:09.040491 IP 192.168.10.201.33600 > 192.168.10.16.24: Flags [.], ack 223950022, win 64240, length 0
16:30:09.040594 IP 192.168.10.16.24 > 192.168.10.201.33600: Flags [F.], seq 223950022, ack 2, win 1024, length 0
16:30:09.040601 IP 192.168.10.201.33600 > 192.168.10.16.24: Flags [.], ack 223950023, win 64240, length 0
