0.000000 0.000000 127.0.0.1.46930 > 127.0.0.1.1234: S 3133196091:3133196091(0) win 16384 <mss 32728,nop,nop,sackOK,nop,wscale 6,nop,nop,timestamp 1106135235 0> (DF)
0.000017 0.000017 127.0.0.1.1234 > 127.0.0.1.46930: S 1572688908:1572688908(0) ack 3133196092 win 16384 <mss 32728,nop,nop,sackOK,nop,wscale 6,nop,nop,timestamp 2223273564 1106135235> (DF)
0.000034 0.000017 127.0.0.1.46930 > 127.0.0.1.1234: . ack 1 win 256 <nop,nop,timestamp 1106135235 2223273564> (DF)
0.000293 0.000259 SO_RCVBUF: 65536 bytes
0.001581 0.001288 127.0.0.1.1234 > 127.0.0.1.46930: P 1:4097(4096) ack 1 win 256 <nop,nop,timestamp 2223273564 1106135235> (DF)
0.001605 0.000024 127.0.0.1.46930 > 127.0.0.1.1234: . ack 4097 win 960 <nop,nop,timestamp 1106135235 2223273564> (DF)
0.001641 0.000036 read returns: 4096 bytes
1.001590 0.999949 127.0.0.1.1234 > 127.0.0.1.46930: P 4097:8193(4096) ack 1 win 256 <nop,nop,timestamp 2223273566 1106135235> (DF)
1.001608 0.000018 127.0.0.1.46930 > 127.0.0.1.1234: . ack 8193 win 960 <nop,nop,timestamp 1106135237 2223273566> (DF)
1.001619 0.000011 read returns: 4096 bytes
2.001601 0.999982 127.0.0.1.1234 > 127.0.0.1.46930: P 8193:12289(4096) ack 1 win 256 <nop,nop,timestamp 2223273568 1106135237> (DF)
2.001617 0.000016 127.0.0.1.46930 > 127.0.0.1.1234: . ack 12289 win 960 <nop,nop,timestamp 1106135239 2223273568> (DF)
2.001627 0.000010 read returns: 4096 bytes
3.001611 0.999984 127.0.0.1.1234 > 127.0.0.1.46930: P 12289:16385(4096) ack 1 win 256 <nop,nop,timestamp 2223273570 1106135239> (DF)
3.001628 0.000017 127.0.0.1.46930 > 127.0.0.1.1234: . ack 16385 win 960 <nop,nop,timestamp 1106135241 2223273570> (DF)
3.001637 0.000009 read returns: 4096 bytes
4.001635 0.999998 127.0.0.1.1234 > 127.0.0.1.46930: P 16385:20481(4096) ack 1 win 256 <nop,nop,timestamp 2223273572 1106135241> (DF)
4.001652 0.000017 127.0.0.1.46930 > 127.0.0.1.1234: . ack 20481 win 960 <nop,nop,timestamp 1106135243 2223273572> (DF)
4.001660 0.000008 read returns: 4096 bytes
5.001654 0.999994 127.0.0.1.1234 > 127.0.0.1.46930: P 20481:24577(4096) ack 1 win 256 <nop,nop,timestamp 2223273574 1106135243> (DF)
5.001666 0.000012 127.0.0.1.46930 > 127.0.0.1.1234: . ack 24577 win 960 <nop,nop,timestamp 1106135245 2223273574> (DF)
5.001674 0.000008 read returns: 4096 bytes
6.001672 0.999998 127.0.0.1.1234 > 127.0.0.1.46930: P 24577:28673(4096) ack 1 win 256 <nop,nop,timestamp 2223273576 1106135245> (DF)
6.001685 0.000013 127.0.0.1.46930 > 127.0.0.1.1234: . ack 28673 win 960 <nop,nop,timestamp 1106135247 2223273576> (DF)
6.001693 0.000008 read returns: 4096 bytes
7.001692 0.999999 127.0.0.1.1234 > 127.0.0.1.46930: P 28673:32769(4096) ack 1 win 256 <nop,nop,timestamp 2223273578 1106135247> (DF)
7.001704 0.000012 127.0.0.1.46930 > 127.0.0.1.1234: . ack 32769 win 960 <nop,nop,timestamp 1106135249 2223273578> (DF)
7.001711 0.000007 read returns: 4096 bytes
8.001710 0.999999 127.0.0.1.1234 > 127.0.0.1.46930: P 32769:36865(4096) ack 1 win 256 <nop,nop,timestamp 2223273580 1106135249> (DF)
8.001723 0.000013 127.0.0.1.46930 > 127.0.0.1.1234: . ack 36865 win 960 <nop,nop,timestamp 1106135251 2223273580> (DF)
8.001733 0.000010 read returns: 4096 bytes
9.001730 0.999997 127.0.0.1.1234 > 127.0.0.1.46930: P 36865:40961(4096) ack 1 win 256 <nop,nop,timestamp 2223273582 1106135251> (DF)
9.001742 0.000012 127.0.0.1.46930 > 127.0.0.1.1234: . ack 40961 win 960 <nop,nop,timestamp 1106135253 2223273582> (DF)
9.001751 0.000009 read returns: 4096 bytes
9.001763 0.000012 sleep 3 seconds
10.001749 0.999986 127.0.0.1.1234 > 127.0.0.1.46930: P 40961:45057(4096) ack 1 win 256 <nop,nop,timestamp 2223273584 1106135253> (DF)
10.001760 0.000011 127.0.0.1.46930 > 127.0.0.1.1234: . ack 45057 win 960 <nop,nop,timestamp 1106135255 2223273584> (DF)
11.001768 1.000008 127.0.0.1.1234 > 127.0.0.1.46930: P 45057:49153(4096) ack 1 win 256 <nop,nop,timestamp 2223273586 1106135255> (DF)
11.001779 0.000011 127.0.0.1.46930 > 127.0.0.1.1234: . ack 49153 win 896 <nop,nop,timestamp 1106135257 2223273586> (DF)
12.000607 0.998828 sleep 3 seconds done
12.000639 0.000032 FIONREAD: 8192 bytes
12.000649 0.000010 do shutdown(, SHUT_RD)
12.000672 0.000023 shutdown(, SHUT_RD) done
12.000685 0.000013 FIONREAD: 0 bytes
12.000695 0.000010 waiting. hit enter to continue
12.001780 0.001085 127.0.0.1.1234 > 127.0.0.1.46930: P 49153:53249(4096) ack 1 win 256 <nop,nop,timestamp 2223273588 1106135257> (DF)
12.001794 0.000014 127.0.0.1.46930 > 127.0.0.1.1234: . ack 53249 win 832 <nop,nop,timestamp 1106135259 2223273588> (DF)
13.001794 1.000000 127.0.0.1.1234 > 127.0.0.1.46930: P 53249:57345(4096) ack 1 win 256 <nop,nop,timestamp 2223273590 1106135259> (DF)
13.001804 0.000010 127.0.0.1.46930 > 127.0.0.1.1234: . ack 57345 win 768 <nop,nop,timestamp 1106135261 2223273590> (DF)
14.001806 1.000002 127.0.0.1.1234 > 127.0.0.1.46930: P 57345:61441(4096) ack 1 win 256 <nop,nop,timestamp 2223273592 1106135261> (DF)
14.001817 0.000011 127.0.0.1.46930 > 127.0.0.1.1234: . ack 61441 win 704 <nop,nop,timestamp 1106135263 2223273592> (DF)
15.001819 1.000002 127.0.0.1.1234 > 127.0.0.1.46930: P 61441:65537(4096) ack 1 win 256 <nop,nop,timestamp 2223273594 1106135263> (DF)
15.001830 0.000011 127.0.0.1.46930 > 127.0.0.1.1234: . ack 65537 win 640 <nop,nop,timestamp 1106135265 2223273594> (DF)
16.001830 1.000000 127.0.0.1.1234 > 127.0.0.1.46930: P 65537:69633(4096) ack 1 win 256 <nop,nop,timestamp 2223273596 1106135265> (DF)
16.001840 0.000010 127.0.0.1.46930 > 127.0.0.1.1234: . ack 69633 win 576 <nop,nop,timestamp 1106135267 2223273596> (DF)
17.001842 1.000002 127.0.0.1.1234 > 127.0.0.1.46930: P 69633:73729(4096) ack 1 win 256 <nop,nop,timestamp 2223273598 1106135267> (DF)
17.001852 0.000010 127.0.0.1.46930 > 127.0.0.1.1234: . ack 73729 win 512 <nop,nop,timestamp 1106135269 2223273598> (DF)
18.001856 1.000004 127.0.0.1.1234 > 127.0.0.1.46930: P 73729:77825(4096) ack 1 win 256 <nop,nop,timestamp 2223273600 1106135269> (DF)
18.001866 0.000010 127.0.0.1.46930 > 127.0.0.1.1234: . ack 77825 win 448 <nop,nop,timestamp 1106135271 2223273600> (DF)
19.001868 1.000002 127.0.0.1.1234 > 127.0.0.1.46930: P 77825:81921(4096) ack 1 win 256 <nop,nop,timestamp 2223273602 1106135271> (DF)
19.001878 0.000010 127.0.0.1.46930 > 127.0.0.1.1234: . ack 81921 win 384 <nop,nop,timestamp 1106135273 2223273602> (DF)
20.001880 1.000002 127.0.0.1.1234 > 127.0.0.1.46930: P 81921:86017(4096) ack 1 win 256 <nop,nop,timestamp 2223273604 1106135273> (DF)
20.001890 0.000010 127.0.0.1.46930 > 127.0.0.1.1234: . ack 86017 win 320 <nop,nop,timestamp 1106135275 2223273604> (DF)
21.001900 1.000010 127.0.0.1.1234 > 127.0.0.1.46930: P 86017:90113(4096) ack 1 win 256 <nop,nop,timestamp 2223273606 1106135275> (DF)
21.001910 0.000010 127.0.0.1.46930 > 127.0.0.1.1234: . ack 90113 win 256 <nop,nop,timestamp 1106135277 2223273606> (DF)
22.001914 1.000004 127.0.0.1.1234 > 127.0.0.1.46930: P 90113:94209(4096) ack 1 win 256 <nop,nop,timestamp 2223273608 1106135277> (DF)
22.001924 0.000010 127.0.0.1.46930 > 127.0.0.1.1234: . ack 94209 win 192 <nop,nop,timestamp 1106135279 2223273608> (DF)
23.001926 1.000002 127.0.0.1.1234 > 127.0.0.1.46930: P 94209:98305(4096) ack 1 win 256 <nop,nop,timestamp 2223273610 1106135279> (DF)
23.001936 0.000010 127.0.0.1.46930 > 127.0.0.1.1234: . ack 98305 win 128 <nop,nop,timestamp 1106135281 2223273610> (DF)
24.001938 1.000002 127.0.0.1.1234 > 127.0.0.1.46930: P 98305:102401(4096) ack 1 win 256 <nop,nop,timestamp 2223273612 1106135281> (DF)
24.001948 0.000010 127.0.0.1.46930 > 127.0.0.1.1234: . ack 102401 win 64 <nop,nop,timestamp 1106135283 2223273612> (DF)
25.001950 1.000002 127.0.0.1.1234 > 127.0.0.1.46930: P 102401:106497(4096) ack 1 win 256 <nop,nop,timestamp 2223273614 1106135283> (DF)
25.001960 0.000010 127.0.0.1.46930 > 127.0.0.1.1234: . ack 106497 win 0 <nop,nop,timestamp 1106135285 2223273614> (DF)
30.989690 5.987730 127.0.0.1.1234 > 127.0.0.1.46930: . 106497:106498(1) ack 1 win 256 <nop,nop,timestamp 2223273626 1106135285> (DF)
30.989703 0.000013 127.0.0.1.46930 > 127.0.0.1.1234: . ack 106497 win 0 <nop,nop,timestamp 1106135297 2223273626> (DF)
31.410952 0.421249 program resume
31.410966 0.000014 FIONREAD: 0 bytes
31.410976 0.000010 do close(sockfd)
31.411016 0.000040 127.0.0.1.46930 > 127.0.0.1.1234: F 1:1(0) ack 106497 win 0 <nop,nop,timestamp 1106135298 2223273626> (DF)
31.411017 0.000001 close(sockfd) done
31.411033 0.000016 127.0.0.1.1234 > 127.0.0.1.46930: . ack 2 win 256 <nop,nop,timestamp 2223273627 1106135298> (DF)
35.983417 4.572384 127.0.0.1.1234 > 127.0.0.1.46930: . 106497:106498(1) ack 2 win 256 <nop,nop,timestamp 2223273636 1106135298> (DF)
35.983435 0.000018 127.0.0.1.46930 > 127.0.0.1.1234: R 3133196093:3133196093(0) win 0 (DF)
